prediction_id,report_number,candidate_seq,bundle_key,claim_normalized,target_name,target_type,time_window_start,time_window_end,match_status,probability_notes,review_rationale
8341,235,14,,"But in the near future, there will be about ninety lives lost in the storms, while many more lives will be lost throughout the year as a result of the other natural events, not to mention the many earthquake deaths, which will cost tens of thousands of lives.",,none,1990-02-03,1995-02-03,unresolved,target unresolved for probability model,Prediction could not be scored because the target location remains unresolved.
8557,238,199,,It will be the same again next year when the severe earthquake demands its tributes.,,none,1992-01-01,1992-12-31,unresolved,target unresolved for probability model,Prediction could not be scored because the target location remains unresolved.
8540,238,182,,"I just want to tell you that a stronger quake on the 2nd of February 1992, will not be very significant.",,none,1992-02-02,1992-02-02,unresolved,target unresolved for probability model,Prediction could not be scored because the target location remains unresolved.
8627,242,1,,"With smaller quakes, however, things will be different, because already on the 8th of May another one of these will occur, which will have to be calculated at a magnitude of about 5.5, if, according to the Richter scale ….",,none,1992-05-08,1992-05-08,unresolved,target unresolved for probability model,Prediction could not be scored because the target location remains unresolved.
9311,383,23,,"On the 10th of April there is a new seaquake off Sumatra with a magnitude of 6.8, after which on the 11th of April the volcano Talang begins to erupt, which will be directly related to the seaquakes off Sumatra.",Sumatra,region,2005-04-10,2005-04-10,unresolved,target unresolved for probability model,Prediction could not be scored because the target location remains unresolved.
9405,400,16,,"This inevitably leads to the fact that sooner or later, in days, weeks, months or even years later, new earthquakes will arise from them, whereby as a rule a very strong earthquake or seaquake somewhere in the world will in turn cause a very strong earthquake or seaquake.",,none,2005-09-25,2007-09-25,unresolved,target unresolved for probability model,Prediction could not be scored because the target location remains unresolved.
9762,519,3,,"In addition to all the following minor aftershocks, another severe seaquake of 7.1 magnitude will occur on the 11th of April.",,none,2011-04-11,2011-04-11,unresolved,target unresolved for probability model,Prediction could not be scored because the target location remains unresolved.
11669,779,483,,"As already explained, the first severe earthquake with many deaths will already occur next year, and in the following year also the first violent volcanic eruptions, which will also be followed by tremendously extreme earthquakes and seaquakes, whereby these will extend far into the 3rd millennium and, becoming worse and worse, will then claim countless human lives.",,none,2022-01-01,2022-12-31,unresolved,target unresolved for probability model,Prediction could not be scored because the target location remains unresolved.
